{
  "locale": "es-419",
  "version": "v1",
  "source": "clusters.json",
  "attribution": "Marble Skill Taxonomy (v1) © Generative Spark, Inc. (Marble) · https://withmarble.com · database under ODbL 1.0 and content under CC BY-SA 4.0. This es-419 Latin American Spanish text is a derivative translation, published in the Tropicalrambler fork, and is distributed under the same licenses.",
  "clusterCount": 183,
  "clusters": [
    {
      "subject": "English",
      "domain": "Grammar & Punctuation",
      "ageRangeStart": 5,
      "summary": "Su hijo o hija está aprendiendo las bases de la escritura: cómo formar oraciones completas, usar correctamente las letras mayúsculas y los signos de puntuación, y comprender tipos básicos de palabras como el sustantivo y el verbo."
    },
    {
      "subject": "English",
      "domain": "Grammar & Punctuation",
      "ageRangeStart": 6,
      "summary": "Su hijo o hija está aprendiendo habilidades importantes de gramática: cómo construir oraciones más complejas, usar la puntuación correctamente y elegir las palabras adecuadas para que su escritura sea más clara y más interesante."
    },
    {
      "subject": "English",
      "domain": "Grammar & Punctuation",
      "ageRangeStart": 7,
      "summary": "Su hijo o hija está aprendiendo una gramática más sofisticada: usar correctamente los verbos irregulares y los plurales, puntuar el diálogo, elegir los pronombres y las conjunciones adecuados, y comprender cuándo usar distintos tiempos verbales."
    },
    {
      "subject": "English",
      "domain": "Grammar & Punctuation",
      "ageRangeStart": 8,
      "summary": "Su hijo o hija está dominando una gramática más sofisticada: aprendiendo a usar correctamente distintos tiempos verbales, comprendiendo cómo funcionan los adjetivos y los adverbios, y usando la puntuación para que su escritura sea más clara y más variada."
    },
    {
      "subject": "English",
      "domain": "Grammar & Punctuation",
      "ageRangeStart": 9,
      "summary": "Su hijo o hija está dominando la gramática y la puntuación avanzadas: usando estructuras de oraciones complejas con cláusulas relativas, comprendiendo cómo cambiar el significado de las palabras con prefijos y sufijos, y creando una escritura cohesiva y bien conectada."
    },
    {
      "subject": "English",
      "domain": "Grammar & Punctuation",
      "ageRangeStart": 10,
      "summary": "Su hijo o hija está aprendiendo habilidades avanzadas de gramática y puntuación: dominando estructuras de oraciones complejas, puntuación sofisticada como los dos puntos y el punto y coma, y técnicas de escritura formal que le prepararán para la secundaria y más adelante."
    },
    {
      "subject": "English",
      "domain": "Handwriting & Transcription",
      "ageRangeStart": 5,
      "summary": "Su hijo o hija está dominando las habilidades físicas de la escritura: aprendiendo a formar las letras y los números correctamente, tomar el lápiz de manera adecuada y desarrollar una escritura a mano ordenada y legible."
    },
    {
      "subject": "English",
      "domain": "Handwriting & Transcription",
      "ageRangeStart": 6,
      "summary": "Su hijo o hija está aprendiendo a unir las letras al escribir, y desarrollando una escritura a mano suave al conectar las letras con trazos diagonales y horizontales, mientras mantiene las letras del tamaño correcto."
    },
    {
      "subject": "English",
      "domain": "Phonics & Word Reading",
      "ageRangeStart": 5,
      "summary": "Su hijo o hija está construyendo la base de la lectura: aprendiendo cómo las letras y los sonidos funcionan juntos, reconociendo palabras comunes de un vistazo y desarrollando la habilidad de unir los sonidos para leer palabras nuevas por su cuenta."
    },
    {
      "subject": "English",
      "domain": "Phonics & Word Reading",
      "ageRangeStart": 6,
      "summary": "Su hijo o hija está aprendiendo a leer palabras más complejas al reconocer distintos patrones de letras para los mismos sonidos y al dividir las palabras más largas en sílabas, y también desarrollando fluidez y expresión al leer en voz alta."
    },
    {
      "subject": "English",
      "domain": "Phonics & Word Reading",
      "ageRangeStart": 7,
      "summary": "Su hijo o hija está aprendiendo a leer palabras más complejas al comprender cómo los prefijos, los sufijos y las palabras raíz funcionan juntos, lo que le ayuda a abordar palabras desconocidas con confianza."
    },
    {
      "subject": "English",
      "domain": "Reading Comprehension",
      "ageRangeStart": 5,
      "summary": "Su hijo o hija está construyendo habilidades de lectura: comprendiendo las historias al identificar personajes y sucesos, haciendo preguntas sobre lo que lee y conectando los libros con sus propias experiencias."
    },
    {
      "subject": "English",
      "domain": "Reading Comprehension",
      "ageRangeStart": 6,
      "summary": "Su hijo o hija está desarrollando habilidades de lectura más profundas: comprendiendo cómo se estructuran las historias, identificando las ideas principales en textos informativos, comparando las perspectivas de los personajes y reconociendo cómo distintas características del texto ayudan a organizar la información."
    },
    {
      "subject": "English",
      "domain": "Reading Comprehension",
      "ageRangeStart": 7,
      "summary": "Su hijo o hija está desarrollando habilidades de lectura más profundas: identificando ideas principales a lo largo de varios párrafos, haciendo inferencias sobre los personajes y los temas, y comprendiendo cómo los autores usan el lenguaje y las características del texto para crear significado y efecto."
    },
    {
      "subject": "English",
      "domain": "Reading Comprehension",
      "ageRangeStart": 8,
      "summary": "Su hijo o hija está aprendiendo a pensar a fondo sobre los textos: estableciendo conexiones entre ideas, analizando las motivaciones de los personajes, identificando los mensajes centrales de las historias y distinguiendo entre su propio punto de vista y el de los autores o el de los personajes."
    },
    {
      "subject": "English",
      "domain": "Reading Comprehension",
      "ageRangeStart": 9,
      "summary": "Su hijo o hija está desarrollando habilidades de lectura sofisticadas: analizando cómo los autores estructuran los textos, comparando distintas perspectivas, comprendiendo los temas y los recursos literarios, e integrando información de varias fuentes."
    },
    {
      "subject": "English",
      "domain": "Reading Comprehension",
      "ageRangeStart": 10,
      "summary": "Su hijo o hija está desarrollando habilidades de lectura sofisticadas: comparando textos, analizando cómo los autores usan la evidencia y la perspectiva, integrando información de varias fuentes y respaldando sus interpretaciones con citas y razonamiento."
    },
    {
      "subject": "English",
      "domain": "Speaking & Listening",
      "ageRangeStart": 5,
      "summary": "Su hijo o hija está desarrollando habilidades esenciales de comunicación: aprendiendo a escuchar con atención, hablar con claridad, participar en conversaciones y expresar sus pensamientos e ideas con confianza junto a otras personas."
    },
    {
      "subject": "English",
      "domain": "Speaking & Listening",
      "ageRangeStart": 6,
      "summary": "Su hijo o hija está construyendo confianza para hablar en voz alta: memorizando y recitando poemas con expresión, y aprendiendo a hablar con claridad en oraciones completas al presentar ante otras personas."
    },
    {
      "subject": "English",
      "domain": "Speaking & Listening",
      "ageRangeStart": 7,
      "summary": "Su hijo o hija está desarrollando confianza como hablante y como oyente: aprendiendo a captar a su audiencia, considerar distintos puntos de vista y elegir un lenguaje adecuado para distintas situaciones."
    },
    {
      "subject": "English",
      "domain": "Speaking & Listening",
      "ageRangeStart": 8,
      "summary": "Su hijo o hija está desarrollando habilidades más sólidas para conversar y presentar: aprendiendo a prepararse para las conversaciones, compartir ideas con claridad y presentar la información de manera organizada."
    },
    {
      "subject": "English",
      "domain": "Speaking & Listening",
      "ageRangeStart": 9,
      "summary": "Su hijo o hija está desarrollando habilidades de escucha crítica, y aprendiendo a identificar las ideas clave de lo que escucha y a evaluar si quien habla ofrece buenas razones y evidencia para sus ideas."
    },
    {
      "subject": "English",
      "domain": "Speaking & Listening",
      "ageRangeStart": 10,
      "summary": "Su hijo o hija está desarrollando habilidades de comunicación sofisticadas: aprendiendo a adaptar su manera de hablar a distintas audiencias, participar de forma reflexiva en las discusiones y crear presentaciones que combinan de manera efectiva las palabras habladas con elementos visuales."
    },
    {
      "subject": "English",
      "domain": "Spelling & Word Study",
      "ageRangeStart": 5,
      "summary": "Su hijo o hija está aprendiendo a escribir palabras conectando los sonidos con las letras: formando palabras simples, agregando terminaciones comunes como «-ing» y «-ed», y memorizando palabras importantes que no siguen los patrones regulares de ortografía."
    },
    {
      "subject": "English",
      "domain": "Spelling & Word Study",
      "ageRangeStart": 6,
      "summary": "Su hijo o hija está aprendiendo reglas de ortografía más avanzadas, como agregar sufijos que cambian la palabra raíz, usar el apóstrofo correctamente en las contracciones y en la posesión, y escribir palabras con patrones de letras alternativos para sonidos conocidos."
    },
    {
      "subject": "English",
      "domain": "Spelling & Word Study",
      "ageRangeStart": 7,